{
    "$schema": "https://json-schema.org/draft/2020-12/schema",
    "$id": "event.schema.json",
    "title": "Archive event",
    "type": "object",
    "required": ["id", "year", "title"],
    "properties": {
        "id": {
            "$ref": "shared.schema.json#/$defs/archiveId"
        },
        "year": {
            "oneOf": [{ "type": "integer" }, { "type": "string", "minLength": 1 }]
        },
        "date": {
            "type": "string"
        },
        "title": {
            "$ref": "shared.schema.json#/$defs/localizedText"
        },
        "summary": {
            "$ref": "shared.schema.json#/$defs/localizedText"
        },
        "description": {
            "$ref": "shared.schema.json#/$defs/localizedHtml"
        },
        "defaultPresentation": {
            "$ref": "variant.schema.json#/$defs/presentation"
        },
        "location": {
            "type": "object",
            "properties": {
                "regionId": {
                    "$ref": "shared.schema.json#/$defs/archiveId"
                },
                "country": {
                    "$ref": "shared.schema.json#/$defs/optionalLocalizedText"
                },
                "place": {
                    "$ref": "shared.schema.json#/$defs/optionalLocalizedText"
                },
                "coordinates": {
                    "$ref": "shared.schema.json#/$defs/coordinates"
                }
            },
            "additionalProperties": true
        },
        "topics": {
            "type": "array",
            "items": {
                "$ref": "shared.schema.json#/$defs/archiveId"
            },
            "uniqueItems": true
        },
        "achievementTypeIds": {
            "type": "array",
            "items": {
                "$ref": "shared.schema.json#/$defs/archiveId"
            },
            "uniqueItems": true
        },
        "figures": {
            "type": "array",
            "items": {
                "type": "object",
                "required": ["figureId"],
                "properties": {
                    "figureId": {
                        "$ref": "shared.schema.json#/$defs/archiveId"
                    },
                    "role": {
                        "$ref": "shared.schema.json#/$defs/optionalLocalizedText"
                    },
                    "primary": {
                        "type": "boolean"
                    },
                    "avatarAssetId": {
                        "$ref": "shared.schema.json#/$defs/archiveId"
                    },
                    "avatarStyle": {
                        "type": "string"
                    },
                    "useDefaultAvatar": {
                        "type": "boolean"
                    }
                },
                "additionalProperties": false
            }
        },
        "organizations": {
            "type": "array",
            "items": {
                "$ref": "shared.schema.json#/$defs/archiveId"
            },
            "uniqueItems": true
        },
        "canonical": {
            "type": "boolean"
        },
        "relatedEventIds": {
            "type": "array",
            "items": {
                "$ref": "shared.schema.json#/$defs/archiveId"
            },
            "uniqueItems": true
        },
        "review": {
            "$ref": "shared.schema.json#/$defs/reviewState"
        }
    },
    "additionalProperties": true
}
